id,keyword,location,text,target,DateTime,Cleaned_Tweet,Latitude,Longitude
4833,evacuation,Australia,Bend Post Office roofers cut gas line prompt evacuation - http://t.co/6mF7eyZOAw,1,2022-11-23 01:17:00,bend post office roofers cut gas line prompt evacuation,-24.7761086,134.755
6416,hurricane,Australia,Grace: here are damage levels Australia style.. #Taiwan #China #world hurricane/typhoon ratings/categories defined again http://t.co/OdYdT9QPk1,1,2022-03-13 00:05:00,grace damage levels australia style taiwan china world hurricanetyphoon ratingscategories defined,-24.7761086,134.755
10210,volcano,Australia,"Japan Aogashima Volcano. By Unknown - Check It Out! http://t.co/OegFQBIqIq
 #Aogashima #Japan #photography #Volcano",1,2017-09-25 17:54:00,japan aogashima volcano unknown check aogashima japan photography volcano,-24.7761086,134.755
3423,derail,Australia,Lake Dallas crash causes train to derail http://t.co/ao4Ju9vMMF,1,2017-11-29 10:54:00,lake dallas crash causes train derail,-24.7761086,134.755
9617,thunderstorm,Australia,@museawayfic @beenghosting @xylodemon ok ok what if I make the close quarters an abandoned cabin in the woods IN A THUNDERSTORM,1,2020-02-06 02:23:00,ok ok make close quarters abandoned cabin woods thunderstorm,-24.7761086,134.755
551,arson,Australia,Thousands attend a rally organized by Peace Now protesting the arson attack that took the life of an http://t.co/bvCKd9pdTi,1,2022-04-28 06:13:00,thousands attend rally organized peace protesting arson attack took life,-24.7761086,134.755
10075,typhoon,Australia,Typhoon Soudelor taking dead aim at Taiwan http://t.co/3Ac5wuy1R0,1,2019-06-04 14:16:00,typhoon soudelor taking dead aim taiwan,-24.7761086,134.755
8423,sandstorm,Australia,Watch This Airport Get Swallowed Up By A Sandstorm In Under A Minute http://t.co/xSZicdWxq0,1,2017-03-27 01:38:00,watch airport get swallowed sandstorm minute,-24.7761086,134.755
8400,sandstorm,Australia,Watch This Airport Get Swallowed Up By A Sandstorm In Under A Minute http://t.co/brctMNybjy,1,2023-01-15 03:21:00,watch airport get swallowed sandstorm minute,-24.7761086,134.755
5803,hail,Australia,Strong Thunderstorm 4 Miles North of Japton Moving SE At 25 MPH. Large Hail and Wind Gusts Up to 50 MPH Poss... #arwx http://t.co/blppzAIbOE,1,2022-11-29 15:15:00,strong thunderstorm miles north japton moving se mph large hail wind gusts mph poss arwx,-24.7761086,134.755
10115,upheaval,Australia,Newberg upheaval: Jacque Betz responds 'looking forward to the day' she can answerÛ_ http://t.co/LzasR05ljo  #news http://t.co/IeMxGSE2BE,0,2020-03-11 13:08:00,newberg upheaval jacque betz responds looking forward day answer news,-24.7761086,134.755
569,arson,Australia,Palestinian Teen Killed Amid Protests Against Arson Attack http://t.co/okVsImoGic,1,2018-03-13 08:51:00,palestinian teen killed amid protests arson attack,-24.7761086,134.755
5200,fatalities,Australia,Las Vegas in top 5 cities for red-light running fatalities http://t.co/kC8O81BcHG,1,2023-04-30 14:17:00,las vegas top cities redlight running fatalities,-24.7761086,134.755
9450,terrorism,Australia,Preacher faces UK terrorism charges http://t.co/daPlllFuqK,1,2017-08-28 23:39:00,preacher faces uk terrorism charges,-24.7761086,134.755
3470,derailed,Australia,@stury Note there were no passengers on board when the train derailed this morning.,1,2020-08-31 19:34:00,note passengers board train derailed morning,-24.7761086,134.755
8404,sandstorm,Australia,Watch This Airport Get Swallowed Up By A Sandstorm In Under A Minute http://t.co/rkU0IDM6aQ,1,2016-07-17 12:04:00,watch airport get swallowed sandstorm minute,-24.7761086,134.755
8419,sandstorm,Australia,Watch This Airport Get Swallowed Up By A Sandstorm In Under A Minute http://t.co/akNyNPv461,1,2018-08-24 20:53:00,watch airport get swallowed sandstorm minute,-24.7761086,134.755
2031,casualties,Australia,'Australian Weapons and Support Are Fueling a Bloody Air War in Yemen' http://t.co/7aGeAkVn2x,1,2017-08-03 23:15:00,australian weapons support fueling bloody air war yemen,-24.7761086,134.755
8433,sandstorm,Australia,Watch This Airport Get Swallowed Up By A Sandstorm In Under A Minute http://t.co/TvYQczGJdy,1,2020-06-16 07:30:00,watch airport get swallowed sandstorm minute,-24.7761086,134.755
287,ambulance,Australia,Twelve feared killed in Pakistani air ambulance helicopter crash http://t.co/TH9YwBbeet #worldNews,1,2018-02-21 18:55:00,twelve feared killed pakistani air ambulance helicopter crash worldnews,-24.7761086,134.755
3182,deluge,Australia,Audio: 16 Business Owners Share What They Would Do Differently Pt1 http://t.co/9uTqe9ZfDE,0,2016-09-13 00:31:00,audio business owners share would differently pt,-24.7761086,134.755
7116,military,Australia,Mike Magner Discusses A Trust Betrayed: http://t.co/psbxl1HvU3 via @YouTube #military #veterans #environment,0,2015-11-05 19:45:00,mike magner discusses trust betrayed via military veterans environment,-24.7761086,134.755
5988,hazardous,Australia,#Taiwan Grace: expect that large rocks trees mud unstable and/or saturated land may slide ..very hazardous in hilly/mountain areas...,1,2019-06-10 12:10:00,taiwan grace expect large rocks trees mud unstable andor saturated land may slide hazardous hillymountain areas,-24.7761086,134.755
8422,sandstorm,Australia,Watch This Airport Get Swallowed Up By A Sandstorm In Under A Minute http://t.co/C9t2F6DLtM,1,2022-01-03 19:29:00,watch airport get swallowed sandstorm minute,-24.7761086,134.755
4624,emergency%20services,Australia,#Breaking #News - Call for Tasmania's emergency services to be trained in horse ... - http://t.co/urJwsVr311 http://t.co/7JfrETeIi4,1,2019-06-10 09:59:00,breaking news call tasmanias emergency services trained horse,-24.7761086,134.755
10628,wounded,Australia,ABC News: Police Officer Wounded Suspect Dead After Exchanging Shots. More #news - http://t.co/AzovGv4SB6,1,2015-08-27 21:30:00,abc news police officer wounded suspect dead exchanging shots news,-24.7761086,134.755
3423,derail,Australia,Lake Dallas crash causes train to derail http://t.co/ao4Ju9vMMF,1,2023-10-11 16:31:00,lake dallas crash causes train derail,-24.7761086,134.755
10613,wounded,Australia,Police Officer Wounded Suspect Dead After Exchanging Shots http://t.co/brE2lGmn7C #ABC #News #AN247,1,2016-06-09 15:57:00,police officer wounded suspect dead exchanging shots abc news,-24.7761086,134.755
10066,typhoon,Australia,#breaking #news Global precipitation measurement satellite captures 3-D image of Typhoon Soudelor - @NASAHurricane http://t.co/20DNcthr4D,1,2018-07-05 19:49:00,breaking news global precipitation measurement satellite captures image typhoon soudelor,-24.7761086,134.755
8441,sandstorm,Australia,Watch This Airport Get Swallowed Up By A Sandstorm In Under A Minute http://t.co/bgM4cSrbVd,1,2023-12-01 12:10:00,watch airport get swallowed sandstorm minute,-24.7761086,134.755
3355,demolition,Australia,EPA begins demolition of homes in toxic area #Buffalo - http://t.co/noRkXBRS6G,1,2022-08-15 07:41:00,epa begins demolition homes toxic area buffalo,-24.7761086,134.755
3423,derail,Australia,Lake Dallas crash causes train to derail http://t.co/ao4Ju9vMMF,1,2016-09-05 00:06:00,lake dallas crash causes train derail,-24.7761086,134.755
461,armageddon,Australia,YOUR PHONE IS SPYING ON YOU! Hidden Back Door NSA Data Mining Software | THE FINANCIAL ARMAGEDDON BLOG http://t.co/qyCw5JJaj1,0,2023-01-06 07:03:00,phone spying hidden back door nsa data mining software financial armageddon blog,-24.7761086,134.755
8419,sandstorm,Australia,Watch This Airport Get Swallowed Up By A Sandstorm In Under A Minute http://t.co/akNyNPv461,1,2022-10-18 13:50:00,watch airport get swallowed sandstorm minute,-24.7761086,134.755
1340,blown%20up,Australia,@troylercraft YEAH ITS NOT WORTH IT BC HE ALREADY HAS SO MANY SPAMMERS &amp; HIS TWITTER IS PROBABLY BLOWN UP EVERY SECOND,0,2023-04-17 07:33:00,yeah worth bc already many spammers amp twitter probably blown every second,-24.7761086,134.755
9949,trouble,Australia,@astros stunningly poor defense it's not all on the pitcher. If our bats are MIA like the top of 1st inning this team is in trouble.,0,2021-01-26 00:10:00,stunningly poor defense pitcher bats mia like top st inning team trouble,-24.7761086,134.755
2808,cyclone,Australia,"#Camera #Art #Photography http://t.co/TJGxDc3D5p #0215 New BoltåÊCyclone DR PP-400DR Dual Outlet Power PackåÊFor External Camera Flash

$30Û_",0,2019-10-11 07:13:00,camera art photography new boltcyclone dr ppdr dual outlet power packfor external camera flash,-24.7761086,134.755
736,attacked,Australia,Christian Attacked by Muslims at the Temple Mount after Waving Israeli Flag via Pamela Geller - ... http://t.co/a6wmbnR51S,1,2018-07-01 04:50:00,christian attacked muslims temple mount waving israeli flag via pamela geller,-24.7761086,134.755
10628,wounded,Australia,ABC News: Police Officer Wounded Suspect Dead After Exchanging Shots. More #news - http://t.co/AzovGv4SB6,1,2022-11-06 20:04:00,abc news police officer wounded suspect dead exchanging shots news,-24.7761086,134.755
10449,wild%20fires,Australia,#FOXDebateQuestions:  To what degree has Obama's efforts to institute Sharia Law exacerbated the California wild fires?,1,2019-03-24 03:21:00,foxdebatequestions degree obamas efforts institute sharia law exacerbated california wild fires,-24.7761086,134.755
9059,structural%20failure,Australia,Virgin galactic crash: early unlocking of brakes triggered structural failure - Irish Examiner http://t.co/ocMCvfDZkv,1,2015-11-10 10:52:00,virgin galactic crash early unlocking brakes triggered structural failure irish examiner,-24.7761086,134.755
3337,demolished,Australia,#BBSNews latest 4 #Palestine &amp; #Israel -  Six Palestinians Kidnapped in West Bank Hebron Home Demolished http://t.co/gne1fW0XHE,1,2021-07-11 14:20:00,bbsnews latest palestine amp israel six palestinians kidnapped west bank hebron home demolished,-24.7761086,134.755
7116,military,Australia,Mike Magner Discusses A Trust Betrayed: http://t.co/psbxl1HvU3 via @YouTube #military #veterans #environment,0,2019-07-30 02:23:00,mike magner discusses trust betrayed via military veterans environment,-24.7761086,134.755
10533,wildfire,Australia,The Latest: #Wildfire destroys more homes but crews advance - WQOW TV News 18 http://t.co/Hj26SFDdfI,1,2021-04-27 21:10:00,latest wildfire destroys homes crews advance wqow tv news,-24.7761086,134.755
5247,fatality,Australia,Kosciusko police investigating pedestrian fatality hit by a train Thursday http://t.co/m5djLLxoZP,0,2019-07-08 05:38:00,kosciusko police investigating pedestrian fatality hit train thursday,-24.7761086,134.755
6416,hurricane,Australia,Grace: here are damage levels Australia style.. #Taiwan #China #world hurricane/typhoon ratings/categories defined again http://t.co/OdYdT9QPk1,1,2021-03-02 08:13:00,grace damage levels australia style taiwan china world hurricanetyphoon ratingscategories defined,-24.7761086,134.755
9450,terrorism,Australia,Preacher faces UK terrorism charges http://t.co/daPlllFuqK,1,2015-11-30 20:04:00,preacher faces uk terrorism charges,-24.7761086,134.755
8435,sandstorm,Australia,Watch This Airport Get Swallowed Up By A Sandstorm In Under A Minute http://t.co/BB7TTdVJWE,1,2018-10-10 01:23:00,watch airport get swallowed sandstorm minute,-24.7761086,134.755
8422,sandstorm,Australia,Watch This Airport Get Swallowed Up By A Sandstorm In Under A Minute http://t.co/C9t2F6DLtM,1,2015-12-01 15:11:00,watch airport get swallowed sandstorm minute,-24.7761086,134.755
6202,hijacker,Australia,How to remove http://t.co/HRSfA8zujI BrowseråÊHijacker http://t.co/vLnjNoLNme http://t.co/iF5RoGFJRi,0,2020-05-01 04:31:00,remove browserhijacker,-24.7761086,134.755
3738,destroyed,Australia,Black Eye 9: A space battle occurred at Star O784 involving 3 fleets totaling 3945 ships with 17 destroyed,0,2023-10-10 03:04:00,black eye space battle occurred star involving fleets totaling ships destroyed,-24.7761086,134.755
5593,flood,Australia,Flood Advisory in effect for Shelby County in AL until 9 PM #alwx http://t.co/gTqMGsgcsB,1,2018-07-15 19:20:00,flood advisory effect shelby county al pm alwx,-24.7761086,134.755
8400,sandstorm,Australia,Watch This Airport Get Swallowed Up By A Sandstorm In Under A Minute http://t.co/brctMNybjy,1,2021-10-07 22:17:00,watch airport get swallowed sandstorm minute,-24.7761086,134.755
3704,destroyed,Australia,Black Eye 9: A space battle occurred at Star O784 involving 3 fleets totaling 3941 ships with 13 destroyed,0,2016-04-14 01:11:00,black eye space battle occurred star involving fleets totaling ships destroyed,-24.7761086,134.755
4509,emergency,Australia,Deals : http://t.co/ddhWoRI5w1 #37592 Temporary Fake Tooth Teeth Replacement Kit Emergency Dental Oral Care CosmeÛ_ http://t.co/ZCvfC500yY,0,2018-01-28 06:48:00,deals temporary fake tooth teeth replacement kit emergency dental oral care cosme,-24.7761086,134.755
79,ablaze,Australia,#Kurds trampling on Turkmen flag later set it ablaze while others vandalized offices of Turkmen Front in #Diyala http://t.co/4IzFdYC3cg,1,2017-06-10 03:46:00,kurds trampling turkmen flag later set ablaze others vandalized offices turkmen front diyala,-24.7761086,134.755
4252,drowning,Australia,Grace: this is not your first ' storm' you know bicycles fences trees will fly as well as idiots drowning that go by swollen rivers...,1,2020-05-30 15:54:00,grace first storm know bicycles fences trees fly well idiots drowning go swollen rivers,-24.7761086,134.755
8422,sandstorm,Australia,Watch This Airport Get Swallowed Up By A Sandstorm In Under A Minute http://t.co/C9t2F6DLtM,1,2015-09-30 18:36:00,watch airport get swallowed sandstorm minute,-24.7761086,134.755
10075,typhoon,Australia,Typhoon Soudelor taking dead aim at Taiwan http://t.co/3Ac5wuy1R0,1,2022-11-23 19:33:00,typhoon soudelor taking dead aim taiwan,-24.7761086,134.755
6202,hijacker,Australia,How to remove http://t.co/HRSfA8zujI BrowseråÊHijacker http://t.co/vLnjNoLNme http://t.co/iF5RoGFJRi,0,2015-02-03 15:13:00,remove browserhijacker,-24.7761086,134.755
3423,derail,Australia,Lake Dallas crash causes train to derail http://t.co/ao4Ju9vMMF,1,2017-07-29 16:05:00,lake dallas crash causes train derail,-24.7761086,134.755
8079,rescue,Australia,"Lunch for the crew is made. Night night it's been a long day! 
~Peace~Love~Rescue~",0,2015-03-31 03:44:00,lunch crew made night night long day peaceloverescue,-24.7761086,134.755
3738,destroyed,Australia,Black Eye 9: A space battle occurred at Star O784 involving 3 fleets totaling 3945 ships with 17 destroyed,0,2017-09-22 14:46:00,black eye space battle occurred star involving fleets totaling ships destroyed,-24.7761086,134.755
4624,emergency%20services,Australia,#Breaking #News - Call for Tasmania's emergency services to be trained in horse ... - http://t.co/urJwsVr311 http://t.co/7JfrETeIi4,1,2016-10-30 12:25:00,breaking news call tasmanias emergency services trained horse,-24.7761086,134.755
838,bioterror,Australia,#News FedEx no longer to transport bioterror germs in wake of anthrax lab mishaps (say what?): åÊFedEx no... http://t.co/K0Y7xFxmXA #TCOT,1,2017-02-05 22:07:00,news fedex longer transport bioterror germs wake anthrax lab mishaps say fedex tcot,-24.7761086,134.755
2031,casualties,Australia,'Australian Weapons and Support Are Fueling a Bloody Air War in Yemen' http://t.co/7aGeAkVn2x,1,2023-01-31 21:50:00,australian weapons support fueling bloody air war yemen,-24.7761086,134.755
3036,death,Australia,I had no issues uploading DEATH TO SMOOCHY or AWAKENINGS clips to @YouTube but for some reason BICENTENNIAL MAN is being a pain in the ass.,0,2016-08-17 14:41:00,issues uploading death smoochy awakenings clips reason bicentennial man pain ass,-24.7761086,134.755
9235,suicide%20bombing,Australia,Turkish troops killed in Kurdish militant 'suicide attack' http://t.co/7old5MJWph,1,2022-07-13 16:03:00,turkish troops killed kurdish militant suicide attack,-24.7761086,134.755
8405,sandstorm,Australia,Watch This Airport Get Swallowed Up By A Sandstorm In Under A Minute http://t.co/7IJlZ6BcSP,1,2016-11-26 05:01:00,watch airport get swallowed sandstorm minute,-24.7761086,134.755
7867,quarantined,Australia,@__ScrambledEggs calling it now: KIA gets banned or quarantined before month's end,0,2019-05-02 03:00:00,calling kia gets banned quarantined months end,-24.7761086,134.755
4689,engulfed,Australia,Car engulfed in flames backs up traffic at ParleyÛªs Summit http://t.co/RmucfjCaZr,1,2018-05-29 13:46:00,car engulfed flames backs traffic parleys summit,-24.7761086,134.755
6069,heat%20wave,Australia,Heat wave in WB heavy losses and no compensations (report) -  http://t.co/wMDihdiz1r (via PalinfoEn)   #Palestine,1,2017-04-14 03:53:00,heat wave wb heavy losses compensations report via palinfoen palestine,-24.7761086,134.755
6742,lava,Australia,Check This Deal : http://t.co/uOoYgBb6aZ Sivan Health and Fitness Basalt Lava Hot Stone Massage Kit with 36 PieceÛ_ http://t.co/JJxcnwBp15,0,2019-01-09 10:21:00,check deal sivan health fitness basalt lava hot stone massage kit piece,,
5310,fear,Australia,"Daily Reflections
August 6
DRIVEN
Driven by a hundred forms of fear self-delusion self-seeking and self-pity... http://t.co/DXfqOu4kT2",0,2018-08-07 20:19:00,daily reflectionsaugust drivendriven hundred forms fear selfdelusion selfseeking selfpity,,
4934,exploded,Australia,If you told me ten years ago that I'd be seeing anime on the big screen... ...I probably would have exploded,0,2015-02-18 19:00:00,told ten years ago id seeing anime big screen probably would exploded,,
2356,collapsed,Australia,@sholt87 @MtGrotto @Eco11C @carlsbadbugkil1 Saved us?Bush lowered tax rate for wealthy n economy collapsed w/Middle Class 401ks destroyed.,0,2018-12-30 02:11:00,saved usbush lowered tax rate wealthy n economy collapsed wmiddle class ks destroyed,,
3182,deluge,Australia,Audio: 16 Business Owners Share What They Would Do Differently Pt1 http://t.co/9uTqe9ZfDE,0,2015-02-08 07:56:00,audio business owners share would differently pt,-24.7761086,134.755
8423,sandstorm,Australia,Watch This Airport Get Swallowed Up By A Sandstorm In Under A Minute http://t.co/xSZicdWxq0,1,2021-11-16 04:49:00,watch airport get swallowed sandstorm minute,-24.7761086,134.755
9617,thunderstorm,Australia,@museawayfic @beenghosting @xylodemon ok ok what if I make the close quarters an abandoned cabin in the woods IN A THUNDERSTORM,1,2017-08-19 16:46:00,ok ok make close quarters abandoned cabin woods thunderstorm,-24.7761086,134.755
5582,flood,Australia,Motors Hot Deals #452 &gt;&gt; http://t.co/ED32PBviO7 10x 27W 12V 24V LED Work Light FLOOD Lamp Tractor Truck SUV UTV AÛ_ http://t.co/IfM6v6480P,0,2022-04-13 12:26:00,motors hot deals gtgt x w v v led work light flood lamp tractor truck suv utv,-24.7761086,134.755
3738,destroyed,Australia,Black Eye 9: A space battle occurred at Star O784 involving 3 fleets totaling 3945 ships with 17 destroyed,0,2020-01-02 07:17:00,black eye space battle occurred star involving fleets totaling ships destroyed,-24.7761086,134.755
2356,collapsed,Australia,@sholt87 @MtGrotto @Eco11C @carlsbadbugkil1 Saved us?Bush lowered tax rate for wealthy n economy collapsed w/Middle Class 401ks destroyed.,0,2015-05-18 05:51:00,saved usbush lowered tax rate wealthy n economy collapsed wmiddle class ks destroyed,-24.7761086,134.755
8441,sandstorm,Australia,Watch This Airport Get Swallowed Up By A Sandstorm In Under A Minute http://t.co/bgM4cSrbVd,1,2015-09-02 08:01:00,watch airport get swallowed sandstorm minute,,
6665,landslide,Australia,Speaking of memorable debates: 60-Second Know-It-All: Ronald Reagan's landslide romp on Election Day in 1980 m... http://t.co/2XOhtjQJWh,0,2021-10-17 10:16:00,speaking memorable debates second knowitall ronald reagans landslide romp election day,,
10066,typhoon,Australia,#breaking #news Global precipitation measurement satellite captures 3-D image of Typhoon Soudelor - @NASAHurricane http://t.co/20DNcthr4D,1,2021-06-02 01:34:00,breaking news global precipitation measurement satellite captures image typhoon soudelor,,
3742,destroyed,Australia,Black Eye 9: A space battle occurred at Star O784 involving 2 fleets totaling 3934 ships with 7 destroyed,0,2019-01-07 12:30:00,black eye space battle occurred star involving fleets totaling ships destroyed,-24.7761086,134.755
3738,destroyed,Australia,Black Eye 9: A space battle occurred at Star O784 involving 3 fleets totaling 3945 ships with 17 destroyed,0,2023-02-13 05:00:00,black eye space battle occurred star involving fleets totaling ships destroyed,-24.7761086,134.755
7116,military,Australia,Mike Magner Discusses A Trust Betrayed: http://t.co/psbxl1HvU3 via @YouTube #military #veterans #environment,0,2017-04-26 06:56:00,mike magner discusses trust betrayed via military veterans environment,-24.7761086,134.755
8404,sandstorm,Australia,Watch This Airport Get Swallowed Up By A Sandstorm In Under A Minute http://t.co/rkU0IDM6aQ,1,2022-04-25 05:20:00,watch airport get swallowed sandstorm minute,-24.7761086,134.755
8404,sandstorm,Australia,Watch This Airport Get Swallowed Up By A Sandstorm In Under A Minute http://t.co/rkU0IDM6aQ,1,2019-07-28 06:21:00,watch airport get swallowed sandstorm minute,-24.7761086,134.755
7205,natural%20disaster,Australia,Coming later this year~ 'THE MAN THAT TATTOOED WOMEN.' A novel based on a real serial killer from #Arkansas &amp; a natural disaster. #NOLA,1,2016-05-05 08:33:00,coming later year man tattooed women novel based real serial killer arkansas amp natural disaster nola,-24.7761086,134.755
8410,sandstorm,Australia,Watch This Airport Get Swallowed Up By A Sandstorm In Under A Minute http://t.co/Rm50vCVjsh,1,2019-07-10 14:52:00,watch airport get swallowed sandstorm minute,-24.7761086,134.755
4859,evacuation,Australia,Evacuation order lifted for Roosevelt after #Wildfire misses town - KOMO News http://t.co/qCpMktGLLR,1,2015-03-14 15:25:00,evacuation order lifted roosevelt wildfire misses town komo news,-24.7761086,134.755
5446,first%20responders,Australia,First Responders Convene for National Summit and Awards on GIS Technology http://t.co/0T9yd557rY #gisuserPR #geoTech,0,2021-09-30 16:25:00,first responders convene national summit awards gis technology gisuserpr geotech,-24.7761086,134.755
6909,mass%20murderer,Australia,#gunsense answer to #GFZ's: break law on the minuscule chance a mass murderer shows up. https://t.co/qEoPMCJbCz,1,2023-02-19 15:56:00,gunsense answer gfzs break law minuscule chance mass murderer shows,-24.7761086,134.755
10511,wildfire,Australia,The Latest: Washington #Wildfire misses town; evacuations end - KHQ Right Now http://t.co/aNlhW2IzkZ,1,2016-05-29 12:13:00,latest washington wildfire misses town evacuations end khq right,-24.7761086,134.755
3337,demolished,Australia,#BBSNews latest 4 #Palestine &amp; #Israel -  Six Palestinians Kidnapped in West Bank Hebron Home Demolished http://t.co/gne1fW0XHE,1,2017-11-27 14:38:00,bbsnews latest palestine amp israel six palestinians kidnapped west bank hebron home demolished,-24.7761086,134.755
4252,drowning,Australia,Grace: this is not your first ' storm' you know bicycles fences trees will fly as well as idiots drowning that go by swollen rivers...,1,2019-05-11 23:41:00,grace first storm know bicycles fences trees fly well idiots drowning go swollen rivers,-24.7761086,134.755
8433,sandstorm,Australia,Watch This Airport Get Swallowed Up By A Sandstorm In Under A Minute http://t.co/TvYQczGJdy,1,2018-12-31 01:37:00,watch airport get swallowed sandstorm minute,,
10449,wild%20fires,Australia,#FOXDebateQuestions:  To what degree has Obama's efforts to institute Sharia Law exacerbated the California wild fires?,1,2016-09-28 00:52:00,foxdebatequestions degree obamas efforts institute sharia law exacerbated california wild fires,-24.7761086,134.755
8433,sandstorm,Australia,Watch This Airport Get Swallowed Up By A Sandstorm In Under A Minute http://t.co/TvYQczGJdy,1,2018-07-06 02:07:00,watch airport get swallowed sandstorm minute,-24.7761086,134.755
805,battle,Australia,Black Eye 9: A space battle occurred at Star M27329 involving 1 fleets totaling 1236 ships with 7 destroyed,1,2020-04-21 18:50:00,black eye space battle occurred star involving fleets totaling ships destroyed,-24.7761086,134.755
4689,engulfed,Australia,Car engulfed in flames backs up traffic at ParleyÛªs Summit http://t.co/RmucfjCaZr,1,2022-10-03 05:22:00,car engulfed flames backs traffic parleys summit,-24.7761086,134.755
2043,casualties,Australia,Another day has passed and THANKFULLY Central Command has CONFIRMED NO new casualties. Please pray for those in... http://t.co/mFSw0tYstA,1,2018-04-30 12:46:00,another day passed thankfully central command confirmed new casualties please pray,-24.7761086,134.755
7831,quarantine,Australia,Reddit Will Now Quarantine OffensiveÛ_ http://t.co/wjWYJBncat #onlinecommunities #reddit #amageddon #freespeech http://t.co/0Erisq25KT,0,2020-07-28 13:13:00,reddit quarantine offensive onlinecommunities reddit amageddon freespeech,-24.7761086,134.755
8668,sinkhole,Australia,Sinkhole Disrupts Downtown Trolley Service #SanDiego - http://t.co/9tb82ZMr2X,1,2018-10-20 17:49:00,sinkhole disrupts downtown trolley service sandiego,-24.7761086,134.755
9220,suicide%20bombing,Australia,Turkish troops killed in Kurdish militant 'suicide attack' http://t.co/7cIbxls55f,1,2022-02-25 15:22:00,turkish troops killed kurdish militant suicide attack,-24.7761086,134.755
9220,suicide%20bombing,Australia,Turkish troops killed in Kurdish militant 'suicide attack' http://t.co/7cIbxls55f,1,2017-09-29 13:45:00,turkish troops killed kurdish militant suicide attack,-24.7761086,134.755
5593,flood,Australia,Flood Advisory in effect for Shelby County in AL until 9 PM #alwx http://t.co/gTqMGsgcsB,1,2016-07-01 00:47:00,flood advisory effect shelby county al pm alwx,-24.7761086,134.755
