id,keyword,location,text,target,DateTime,Cleaned_Tweet,Latitude,Longitude
105,accident,Australia,BigRigRadio Live Accident Awareness,1,2016-05-15 09:46:00,bigrigradio live accident awareness,,
623,arsonist,"Adelaide, South Australia",Arsonists being blamed for a blaze at a plastics recycling business in Adelaide | @pcaldicott7 reports. #7NewsAdl http://t.co/r1Xwdnvb0g,0,2020-01-17 03:10:00,arsonists blamed blaze plastics recycling business adelaide reports newsadl,,
826,battle,Australia,"#LonePine remembered around Australia as 'descendants' grow via @666canberra #Gallipoli #WW1
http://t.co/T4fvVnRPc5 http://t.co/0zZnbVFUVO",0,2022-05-28 22:21:00,lonepine remembered around australia descendants grow via gallipoli ww,,
945,blaze,Australia,Property losses from California wildfire nearly double as week-old blaze rages http://t.co/E0UUsnpsq5,1,2018-10-14 12:18:00,property losses california wildfire nearly double weekold blaze rages,,
1303,bloody,"Adelaide, South Australia",@MrTophyPup it's bloody sexy *drools*,0,2017-10-04 12:43:00,bloody sexy drools,,
1545,bomb,Australia,New Documents Found Pointing To Japan's WWII Atomic Bomb Program http://t.co/IucPcSfbMT,1,2018-06-13 16:09:00,new documents found pointing japans wwii atomic bomb program,,
1636,bombing,"Sydney, Australia",Today marks the 70th anniversary of the bombing of Hiroshima a city I visited and was humbled by in November 2013 http://t.co/AcC1z5Q9Zw,1,2018-01-12 20:45:00,today marks th anniversary bombing hiroshima city visited humbled november,,
1723,buildings%20burning,"Mackay, QLD, Australia",Mmmmmm I'm burning.... I'm burning buildings I'm building.... Oooooohhhh oooh ooh...,1,2021-08-15 18:45:00,mmmmmm im burning im burning buildings im building oooooohhhh oooh ooh,,
1799,buildings%20on%20fire,Brisbane Australia,Fire hazard associated with installation of non-compliant external cladding on high-rise buildings - Insurance - Aust http://t.co/wFsEaOBATo,0,2016-11-05 12:59:00,fire hazard associated installation noncompliant external cladding highrise buildings insurance aust,,
1914,burning,Australian Capital Territory,#?x?: :and to counter acts such as the burning of the Alexandrian library.,1,2018-06-24 12:35:00,x counter acts burning alexandrian library,,
1922,burning%20buildings,"Mackay, QLD, Australia",Mmmmmm I'm burning.... I'm burning buildings I'm building.... Oooooohhhh oooh ooh...,0,2018-08-04 06:22:00,mmmmmm im burning im burning buildings im building oooooohhhh oooh ooh,,
1985,bush%20fires,Melbourne Australia,The Public Health Team was traumatised after the bush fires. Could #AppreciativeInquiry turn this around? http://t.co/soEa1GgbKj,1,2018-03-05 20:22:00,public health team traumatised bush fires could appreciativeinquiry turn around,,
1989,bush%20fires,"Canberra, Australian Capital Territory",Californian Bush Fires 2015 http://t.co/rjdX29wosp,1,2017-08-18 16:21:00,californian bush fires,,
2000,bush%20fires,"Sydney, Australia",SMH photographer Wolter Peeters was on the front line with NSW Rural Fire Service crews laÛ_ http://t.co/gXe7nHwZ3e http://t.co/sRbqlMuwbV,1,2022-03-14 20:19:00,smh photographer wolter peeters front line nsw rural fire service crews la,,
2251,chemical%20emergency,"Orbost, Victoria, Australia","Lindenow: 3:15pm
Emergency crews are at a chemical spill in the main street near Church Street",1,2019-01-14 07:44:00,lindenow pmemergency crews chemical spill main street near church street,,
2289,cliff%20fall,Sydney Australia,News Update Huge cliff landslide on road in China - Watch the moment a cliff collapses as huge chunks of rock fall... http://t.co/gaBd0cjmAG,1,2015-01-26 05:04:00,news update huge cliff landslide road china watch moment cliff collapses huge chunks rock fall,,
2399,collapsed,"Perth, Western Australia",@xDescry I was wrong to call it trusty actually.. considering it spontaneously collapsed on me that's not very trusty.,1,2015-08-17 13:52:00,wrong call trusty actually considering spontaneously collapsed thats trusty,,
2571,crash,"Melbourne, Australia","#INCIDENT
Crash in Pascoe Vale South outbound on Tullamarine Fwy (CityLink) near Moreland Rd. Vehicles off in emergency lane. No delays.",1,2023-10-02 14:17:00,incidentcrash pascoe vale south outbound tullamarine fwy citylink near moreland rd vehicles emergency lane delays,,
2579,crash,"  Melbourne, Australia",@DestinyTheGame @Bungie @PlayStation Getting kicked out by that crash is one of the worst experiences I've had playing video games.,0,2018-05-27 15:27:00,getting kicked crash one worst experiences ive playing video games,,
2767,curfew,"Adelaide, Australia",INFO S. WND: 030/6. CLD: SCT014 BKN032. EXP INST APCH. RWY 05. CURFEW IN OPER UNTIL 2030 Z. TAXIWAYS FOXTROT 5 &amp; FOXTROT 6 NAVBL. TMP: 10.,0,2021-11-02 02:22:00,info wnd cld sct bkn exp inst apch rwy curfew oper z taxiways foxtrot amp foxtrot navbl tmp,,
2787,curfew,"Adelaide, Australia",INFO R. CURFEW IN OPER UNTIL 2030 Z. TAXIWAYS FOXTROT 5 &amp; FOXTROT 6 NAVBL. WND: 060/5. EXP INST APCH. RWY 05. DAMP. TMP: 10. QNH: 1028.,0,2015-11-25 04:16:00,info r curfew oper z taxiways foxtrot amp foxtrot navbl wnd exp inst apch rwy damp tmp qnh,,
2792,curfew,"Adelaide, Australia",INFO U. CLD: SCT012 BKN025. EXP INST APCH. RWY 05. CURFEW IN OPER UNTIL 2030 Z. TAXIWAYS FOXTROT 5 &amp; FOXTROT 6 NAVBL. TMP: 10. WND: 030/6.,0,2019-05-03 01:12:00,info u cld sct bkn exp inst apch rwy curfew oper z taxiways foxtrot amp foxtrot navbl tmp wnd,,
2896,damage,Australia,Thank you @RicharkKirkArch @AusInstArchitect for words of warning re #QueensWharf #Brisbane http://t.co/jMkYWhv7mP via @FinancialReview,0,2022-10-23 02:43:00,thank words warning queenswharf brisbane via,,
3165,deluge,Australia,WA smiles after July deluge - The West Australian https://t.co/4Yi4nuovbV via @Yahoo7,0,2017-11-19 07:11:00,wa smiles july deluge west australian via,,
3845,detonate,"Sydney, Australia",New music from @ApolloBrown featuring M.O.P.? 'Detonate' taken off his album 'Grandeur' coming soon - http://t.co/m1xYkEcRzr,0,2021-06-09 03:43:00,new music featuring mop detonate taken album grandeur coming soon,,
4368,earthquake,"Melbourne, Australia",Nepal earthquake 3 months on: Women fear abuse https://t.co/iCTtZ0Divr via @@loupascale,1,2019-08-05 17:00:00,nepal earthquake months women fear abuse via,,
4534,emergency,"Melbourne, Australia",From @LeanDOTorg: Lean Thinking for Quicker Police Emergency Response Time http://t.co/suZBkyW5TT,0,2020-04-05 15:54:00,lean thinking quicker police emergency response time,,
4740,evacuate,"Gold Coast, Qld, Australia",myGC: Broken powerlines evacuate Gold Coast tram suspend services http://t.co/6e7hHfeRz4,1,2018-04-08 15:15:00,mygc broken powerlines evacuate gold coast tram suspend services,,
4785,evacuated,"Queensland, Australia",Passengers evacuated &amp; lanes blocked off as power lines come down over a Gold Coast tram @9NewsGoldCoast http://t.co/zZweEezJuG,1,2016-10-01 03:48:00,passengers evacuated amp lanes blocked power lines come gold coast tram,,
4810,evacuated,"Gold Coast, Australia",Tram travellers evacuated after powerlines come down in Surfers http://t.co/Qsheu3yF0W,1,2021-02-14 04:46:00,tram travellers evacuated powerlines come surfers,,
4826,evacuation,Sydney Australia,Our mission to see the end of this movie last night @markoturner @annaciclismo after getting fire alarm evacuation http://t.co/5kFOVovjso,1,2019-08-19 03:35:00,mission see end movie last night getting fire alarm evacuation,,
4845,evacuation,"sydney, australia",my school just put the evacuation alarms on accidently with 2 different trial exams happening are you kidding me,0,2015-03-18 01:40:00,school put evacuation alarms accidently different trial exams happening kidding,,
4877,explode,Australia,It's cold and my head wants to explode.. The joys of working from home - I'm going back to bed / peace out ????,0,2016-03-06 23:39:00,cold head wants explode joys working home im going back bed peace,,
4924,exploded,Australia,Junko was 13 years old when the atomic bomb exploded over #Hiroshima on August 6 1945. http://t.co/lSpnyCVoLO http://t.co/Nh5pkFBfqm,1,2019-11-21 14:58:00,junko years old atomic bomb exploded hiroshima august,,
5131,fatal,"New South Wales, Australia",Man charged over fatal crash near Dubbo refused bail http://t.co/HDBMfOVUtZ via @dailyliberal,1,2015-12-17 20:54:00,man charged fatal crash near dubbo refused bail via,,
5353,fire,"Sydney, Australia",I just checked in! ÛÒ at On Fire on @ZomatoAUS #LoveFood http://t.co/9l5kqykrbG,1,2019-04-03 16:47:00,checked fire lovefood,,
5567,flood,"Warrandyte, Australia",A [small] flood with bigåÊconsequences https://t.co/CVPdVHxd1R http://t.co/FDMXP4FcMo,1,2016-12-16 20:30:00,small flood bigconsequences,,
5664,floods,Australia,In #India 119000 people have taken shelter in the 966 relief camps the government has set up after the #floods:   http://t.co/eU8jypIzsd,1,2015-11-16 23:32:00,india people taken shelter relief camps government set floods,,
5670,floods,"Sherwood, Brisbane, Australia",@madonnamking RSPCA site multiple 7 story high rise buildings next to low density character residential in an area that floods,0,2022-11-24 03:08:00,rspca site multiple story high rise buildings next low density character residential area floods,,
5889,harm," Queensland, Australia",Vanderbilt: First Do No Harm http://t.co/cCdx7CGlQW,0,2023-11-13 18:09:00,vanderbilt first harm,,
5937,hazard,Australia,#Lifestyle Û÷It makes me sickÛª: Baby clothes deemed a Û÷hazardÛª http://t.co/0XrfVidxA2 http://t.co/oIHwgEZDCk,0,2016-03-07 05:32:00,lifestyle makes sick baby clothes deemed hazard,,
6243,hijacking,"perth, australia ",#hot  Funtenna: hijacking computers to send data as sound waves [Black Hat 2015] http://t.co/gUJNPLJVvt #prebreak #best,0,2016-08-09 02:37:00,hot funtenna hijacking computers send data sound waves black hat prebreak best,,
6245,hijacking,"brisbane, australia",#hot  Funtenna: hijacking computers to send data as sound waves [Black Hat 2015] http://t.co/s4PNIhJQX7 #prebreak #best,0,2016-12-25 21:42:00,hot funtenna hijacking computers send data sound waves black hat prebreak best,,
6328,hostage,Australia ,New ISIS Video: ISIS Threatens to Behead Croatian Hostage Within 48 Hours - TLVFaces - TLVFaces#auspol http://t.co/a6PPEgeLOX,1,2017-08-28 09:12:00,new isis video isis threatens behead croatian hostage within hours tlvfaces tlvfacesauspol,,
6607,inundated,Australia,Kids are inundated with images and information online and in media and have no way to deconstruct. - Kerri Sackville #TMS7,0,2017-04-13 15:16:00,kids inundated images information online media way deconstruct kerri sackville tms,,
6625,inundated,"UK, Republic of Ireland and Australia",Inundated with employee holiday request paperwork? Our cloud based HR software @hronlinetweets will help simplify your staffing logistics.,0,2020-01-19 13:53:00,inundated employee holiday request paperwork cloud based hr software help simplify staffing logistics,,
6649,landslide,"Melbourne, Australia",@kemal_atlay caught in a landslide,1,2016-10-01 06:56:00,caught landslide,-37.8142454,144.9631732
6849,mass%20murder,"Victoria, Australia, Earth",@samanthaturne19 It was... Nagaski another act of mass murder sanctioned and forgiven cause the Allies won... Not by me.,1,2017-09-16 15:38:00,nagaski another act mass murder sanctioned forgiven cause allies,,
6855,mass%20murder,"Victoria, Australia, Earth",@samanthaturne19 IIt may logically have been the right call... maybe... But it's an act of mass murder and I can't sanction it.,1,2017-05-16 17:54:00,iit may logically right call maybe act mass murder cant sanction,,
6867,mass%20murder,"Melbourne, Australia",Hiroshima - one of history's worst examples of mass murder  http://t.co/TmogTi6FB4 #hiroshima #war #atombomb #japan,1,2023-11-26 22:42:00,hiroshima one historys worst examples mass murder hiroshima war atombomb japan,-37.8142454,144.9631732
6876,mass%20murder," Queensland, Australia",Urgent! Save the Salt River #WildHorses! Mass murder by the very ppl supposed to protect them?  --&gt; http://t.co/14wH0pJJ2C @CNN @CBC,1,2017-03-23 06:22:00,urgent save salt river wildhorses mass murder ppl supposed protect gt,-22.1646782,144.5844903
8031,refugees,Melbourne Australia,Captain Abbott must go down with LNP boat #refugees #christianvalues https://t.co/Kp5dpOaF58,0,2015-12-31 00:10:00,captain abbott must go lnp boat refugees christianvalues,-37.8142454,144.9631732
8039,refugees,Australia,Newlyweds feed thousands of Syrian refugees instead of hosting a banquet wedding dinner http://t.co/EGcv7ybjae #Age #news,0,2021-04-26 07:54:00,newlyweds feed thousands syrian refugees instead hosting banquet wedding dinner age news,-24.7761086,134.755
8057,refugees,QLD Australia,The 46 returned refugees - what were they fleeing from &amp; how will the Vietnamese Govt treat them now they are returned? #Dutton #presser,1,2021-02-01 05:34:00,returned refugees fleeing amp vietnamese govt treat returned dutton presser,-22.1646782,144.5844903
8250,rioting,Australia,Twitter is doing a count down to the rioting and financial collapse of Brazil #Rio2016 http://t.co/9mtrq5Jf4d,1,2019-01-05 17:00:00,twitter count rioting financial collapse brazil rio,-24.7761086,134.755
8577,screams,"Melbourne, Australia.",@OllyMursAus I do feel sorry for him! He is not a piece of meat! He is a nice guy... People don't need to rush him and screams in his face!,1,2022-11-08 04:45:00,feel sorry piece meat nice guy people dont need rush screams face,-37.8142454,144.9631732
8837,sirens,Australia,MarketforceÛªs ÛÏCat SharkÛ wins Sirens round two http://t.co/6F9aFQL6WP #radio #news,0,2023-11-17 05:23:00,marketforces cat shark wins sirens round two radio news,-24.7761086,134.755
8908,snowstorm,Australia,@Habbo bring back games from the past. Snowstorm. Tic tac toe. Battleships. Fast food. Matchwood.,1,2016-08-30 02:53:00,bring back games past snowstorm tic tac toe battleships fast food matchwood,-24.7761086,134.755
9194,suicide%20bombing,Australia,@daisycuttertz @GROGParty @Tony_Burke He's been having lessons in suicide bombing from his imam!,1,2022-04-20 03:24:00,hes lessons suicide bombing imam,-24.7761086,134.755
9226,suicide%20bombing,Australia,Erdogan's Bloody Gambit: on July 20 a suicide bombing in Turkey took the lives of 31 socialists in SuruÌ¤ http://t.co/z6xAUIDRXu @Shareaholic,1,2019-07-08 09:54:00,erdogans bloody gambit july suicide bombing turkey took lives socialists suru,-24.7761086,134.755
9393,survivors,AUSTRALIA-SOUTHAFRICA-CAMBODIA,The Cafe Run by Acid Attack Survivors in #India http://t.co/qmiF0bLwOa http://t.co/l6PIf3LpEn,1,2015-05-01 06:55:00,cafe run acid attack survivors india,,
9910,trouble,"Gold Coast, Australia",19 Things You'll Understand If You Have Trouble Talking to People http://t.co/sHaZNLMsFE,0,2018-05-25 14:42:00,things youll understand trouble talking people,-28.0023731,153.4145987
10157,upheaval,"Perth, Western Australia",@abcnews UK scandal of 2009 caused major upheaval to Parliamentary expenses with subsequent sackings and prison. What are we waiting for?,0,2019-02-10 06:32:00,uk scandal caused major upheaval parliamentary expenses subsequent sackings prison waiting,-31.9558933,115.8605855
10208,volcano,"Perth, Australia",Jetstar and Virgin forced to cancel Bali flights again because of ash from Mount Raung volcano http://t.co/jTJoFLtMS4,1,2016-12-16 19:29:00,jetstar virgin forced cancel bali flights ash mount raung volcano,-31.9558933,115.8605855
10496,wildfire,Australia,NowPlaying GT &amp; Wildfire feat. Freaks In Love Feels Like It Should (Original Mix) Massive Dance Radio ListenLive: http://t.co/ANoDGXZR3E,0,2023-12-18 02:07:00,nowplaying gt amp wildfire feat freaks love feels like original mix massive dance radio listenlive,-24.7761086,134.755
6069,heat%20wave,Australia,Heat wave in WB heavy losses and no compensations (report) -  http://t.co/wMDihdiz1r (via PalinfoEn)   #Palestine,1,2021-08-20 05:08:00,heat wave wb heavy losses compensations report via palinfoen palestine,-24.7761086,134.755
8411,sandstorm,Australia,Watch This Airport Get Swallowed Up By A Sandstorm In Under A Minute http://t.co/1tr2KvXCTW,1,2019-03-12 09:59:00,watch airport get swallowed sandstorm minute,-24.7761086,134.755
4689,engulfed,Australia,Car engulfed in flames backs up traffic at ParleyÛªs Summit http://t.co/RmucfjCaZr,1,2020-03-17 05:20:00,car engulfed flames backs traffic parleys summit,-24.7761086,134.755
1340,blown%20up,Australia,@troylercraft YEAH ITS NOT WORTH IT BC HE ALREADY HAS SO MANY SPAMMERS &amp; HIS TWITTER IS PROBABLY BLOWN UP EVERY SECOND,0,2018-09-04 09:41:00,yeah worth bc already many spammers amp twitter probably blown every second,-24.7761086,134.755
8431,sandstorm,Australia,Watch This Airport Get Swallowed Up By A Sandstorm In Under A Minute http://t.co/87H5MbA3N1,1,2017-09-03 00:58:00,watch airport get swallowed sandstorm minute,-24.7761086,134.755
8435,sandstorm,Australia,Watch This Airport Get Swallowed Up By A Sandstorm In Under A Minute http://t.co/BB7TTdVJWE,1,2022-02-05 06:41:00,watch airport get swallowed sandstorm minute,-24.7761086,134.755
316,annihilated,Australia,One thing for sure-God has promised Israel will not be annihilated. But...the horror of Iran w/nukes. https://t.co/xn09Mx6sxy,0,2018-07-05 12:48:00,one thing suregod promised israel annihilated butthe horror iran wnukes,-24.7761086,134.755
3182,deluge,Australia,Audio: 16 Business Owners Share What They Would Do Differently Pt1 http://t.co/9uTqe9ZfDE,0,2019-09-18 03:54:00,audio business owners share would differently pt,-24.7761086,134.755
3423,derail,Australia,Lake Dallas crash causes train to derail http://t.co/ao4Ju9vMMF,1,2019-07-21 11:51:00,lake dallas crash causes train derail,-24.7761086,134.755
3423,derail,Australia,Lake Dallas crash causes train to derail http://t.co/ao4Ju9vMMF,1,2016-01-10 11:23:00,lake dallas crash causes train derail,-24.7761086,134.755
8422,sandstorm,Australia,Watch This Airport Get Swallowed Up By A Sandstorm In Under A Minute http://t.co/C9t2F6DLtM,1,2020-08-27 00:47:00,watch airport get swallowed sandstorm minute,-24.7761086,134.755
9949,trouble,Australia,@astros stunningly poor defense it's not all on the pitcher. If our bats are MIA like the top of 1st inning this team is in trouble.,0,2020-11-15 01:28:00,stunningly poor defense pitcher bats mia like top st inning team trouble,-24.7761086,134.755
8079,rescue,Australia,"Lunch for the crew is made. Night night it's been a long day! 
~Peace~Love~Rescue~",0,2015-07-24 23:16:00,lunch crew made night night long day peaceloverescue,-24.7761086,134.755
8404,sandstorm,Australia,Watch This Airport Get Swallowed Up By A Sandstorm In Under A Minute http://t.co/rkU0IDM6aQ,1,2023-09-08 07:43:00,watch airport get swallowed sandstorm minute,-24.7761086,134.755
3742,destroyed,Australia,Black Eye 9: A space battle occurred at Star O784 involving 2 fleets totaling 3934 ships with 7 destroyed,0,2018-11-28 06:51:00,black eye space battle occurred star involving fleets totaling ships destroyed,-24.7761086,134.755
8431,sandstorm,Australia,Watch This Airport Get Swallowed Up By A Sandstorm In Under A Minute http://t.co/87H5MbA3N1,1,2019-06-12 21:38:00,watch airport get swallowed sandstorm minute,-24.7761086,134.755
4252,drowning,Australia,Grace: this is not your first ' storm' you know bicycles fences trees will fly as well as idiots drowning that go by swollen rivers...,1,2015-07-05 03:21:00,grace first storm know bicycles fences trees fly well idiots drowning go swollen rivers,-24.7761086,134.755
3182,deluge,Australia,Audio: 16 Business Owners Share What They Would Do Differently Pt1 http://t.co/9uTqe9ZfDE,0,2022-01-16 08:15:00,audio business owners share would differently pt,-24.7761086,134.755
6202,hijacker,Australia,How to remove http://t.co/HRSfA8zujI BrowseråÊHijacker http://t.co/vLnjNoLNme http://t.co/iF5RoGFJRi,0,2019-12-14 03:00:00,remove browserhijacker,-24.7761086,134.755
736,attacked,Australia,Christian Attacked by Muslims at the Temple Mount after Waving Israeli Flag via Pamela Geller - ... http://t.co/a6wmbnR51S,1,2015-10-29 20:47:00,christian attacked muslims temple mount waving israeli flag via pamela geller,-24.7761086,134.755
3337,demolished,Australia,#BBSNews latest 4 #Palestine &amp; #Israel -  Six Palestinians Kidnapped in West Bank Hebron Home Demolished http://t.co/gne1fW0XHE,1,2015-08-16 08:03:00,bbsnews latest palestine amp israel six palestinians kidnapped west bank hebron home demolished,-24.7761086,134.755
3182,deluge,Australia,Audio: 16 Business Owners Share What They Would Do Differently Pt1 http://t.co/9uTqe9ZfDE,0,2022-10-05 19:05:00,audio business owners share would differently pt,-24.7761086,134.755
8411,sandstorm,Australia,Watch This Airport Get Swallowed Up By A Sandstorm In Under A Minute http://t.co/1tr2KvXCTW,1,2015-05-17 03:57:00,watch airport get swallowed sandstorm minute,-24.7761086,134.755
2415,collide,Australia,When high fashion and food collide: Gucci has chosen one of ShanghaiÛªs most popular commercial avenue... http://t.co/MkRxQZeHmY #fashion,0,2017-07-08 00:26:00,high fashion food collide gucci chosen one shanghais popular commercial avenue fashion,-24.7761086,134.755
8418,sandstorm,Australia,Watch This Airport Get Swallowed Up By A Sandstorm In Under A Minute http://t.co/sEquWmvFx4,1,2022-11-15 04:14:00,watch airport get swallowed sandstorm minute,-24.7761086,134.755
6038,heat%20wave,Australia,Heat Advisory is In Effect From 1 PM Through 7 PM Thursday. A Building Heat Wave and Increasing Humidity... #lawx http://t.co/u0SYkowVWV,1,2018-09-23 19:38:00,heat advisory effect pm pm thursday building heat wave increasing humidity lawx,-24.7761086,134.755
10066,typhoon,Australia,#breaking #news Global precipitation measurement satellite captures 3-D image of Typhoon Soudelor - @NASAHurricane http://t.co/20DNcthr4D,1,2016-08-12 07:43:00,breaking news global precipitation measurement satellite captures image typhoon soudelor,-24.7761086,134.755
3337,demolished,Australia,#BBSNews latest 4 #Palestine &amp; #Israel -  Six Palestinians Kidnapped in West Bank Hebron Home Demolished http://t.co/gne1fW0XHE,1,2021-06-14 12:05:00,bbsnews latest palestine amp israel six palestinians kidnapped west bank hebron home demolished,-24.7761086,134.755
6466,injured,Australia,Offers : http://t.co/Gl3C1vc88P #8392 Deluxe Toilet Safety Support/Health/Home/Bathroom/Support/Elderly/Injured/SÛ_ http://t.co/vihdoKScCC,1,2023-02-25 06:32:00,offers deluxe toilet safety supporthealthhomebathroomsupportelderlyinjureds,-24.7761086,134.755
8433,sandstorm,Australia,Watch This Airport Get Swallowed Up By A Sandstorm In Under A Minute http://t.co/TvYQczGJdy,1,2019-09-24 04:28:00,watch airport get swallowed sandstorm minute,-24.7761086,134.755
5310,fear,Australia,"Daily Reflections
August 6
DRIVEN
Driven by a hundred forms of fear self-delusion self-seeking and self-pity... http://t.co/DXfqOu4kT2",0,2018-08-26 10:38:00,daily reflectionsaugust drivendriven hundred forms fear selfdelusion selfseeking selfpity,-24.7761086,134.755
7768,police,Australia,$1 million bail for man accused of #shooting at Fife #police - Aug 5 @ 8:16 PM ET http://t.co/hu5CXqnoBf,1,2016-02-21 01:50:00,million bail man accused shooting fife police aug pm et,-24.7761086,134.755
3182,deluge,Australia,Audio: 16 Business Owners Share What They Would Do Differently Pt1 http://t.co/9uTqe9ZfDE,0,2017-02-09 23:30:00,audio business owners share would differently pt,-24.7761086,134.755
4922,exploded,Australia,The Dress Memes Have Officially Exploded On The Internet http://t.co/yG32yb2jDY,0,2022-05-24 07:34:00,dress memes officially exploded internet,-24.7761086,134.755
5310,fear,Australia,"Daily Reflections
August 6
DRIVEN
Driven by a hundred forms of fear self-delusion self-seeking and self-pity... http://t.co/DXfqOu4kT2",0,2015-10-27 08:13:00,daily reflectionsaugust drivendriven hundred forms fear selfdelusion selfseeking selfpity,-24.7761086,134.755
287,ambulance,Australia,Twelve feared killed in Pakistani air ambulance helicopter crash http://t.co/TH9YwBbeet #worldNews,1,2020-10-11 11:53:00,twelve feared killed pakistani air ambulance helicopter crash worldnews,-24.7761086,134.755
8432,sandstorm,Australia,Watch This Airport Get Swallowed Up By A Sandstorm In Under A Minute http://t.co/8L4RFFZD0P,1,2022-05-09 11:43:00,watch airport get swallowed sandstorm minute,-24.7761086,134.755
8405,sandstorm,Australia,Watch This Airport Get Swallowed Up By A Sandstorm In Under A Minute http://t.co/7IJlZ6BcSP,1,2023-07-10 07:40:00,watch airport get swallowed sandstorm minute,-24.7761086,134.755
7116,military,Australia,Mike Magner Discusses A Trust Betrayed: http://t.co/psbxl1HvU3 via @YouTube #military #veterans #environment,0,2021-10-13 19:32:00,mike magner discusses trust betrayed via military veterans environment,-24.7761086,134.755
9235,suicide%20bombing,Australia,Turkish troops killed in Kurdish militant 'suicide attack' http://t.co/7old5MJWph,1,2020-03-13 06:32:00,turkish troops killed kurdish militant suicide attack,-24.7761086,134.755
5247,fatality,Australia,Kosciusko police investigating pedestrian fatality hit by a train Thursday http://t.co/m5djLLxoZP,0,2023-07-09 06:58:00,kosciusko police investigating pedestrian fatality hit train thursday,-24.7761086,134.755
5617,flooding,Australia,Severe Thunderstorms and Flash Flooding Possible in the Mid-South and Midwest http://t.co/uAhIcWpIh4 #WEATHER #ENVIRONMENT #CLIMATE #NATURE,1,2020-09-02 21:47:00,severe thunderstorms flash flooding possible midsouth midwest weather environment climate nature,-24.7761086,134.755
9949,trouble,Australia,@astros stunningly poor defense it's not all on the pitcher. If our bats are MIA like the top of 1st inning this team is in trouble.,0,2021-11-04 22:51:00,stunningly poor defense pitcher bats mia like top st inning team trouble,-24.7761086,134.755
